{"schema_version":"curriculum-blueprint-v1","contract_version":"1.0.0","verification_status":"draft-validated","open_issues":[],"course":{"id":"CUR-ROBOT-001","title":"工业机器人工作站装调与数字孪生实训","job_ids":["JOB-ROBOT-001"],"total_hours":48,"delivery_mode":"blended","learning_outcomes":["完成安全点检、示教编程与坐标标定","在数字孪生环境完成I/O调试、碰撞验证和故障恢复"]},"modules":[{"id":"MOD-ROBOT-SAFETY","title":"机器人工作站安全与点检","competency_ids":["COMP-ROBOT-SAFETY"],"hours":12,"learning_outcomes":["按清单完成安全点检并在急停/联锁异常时安全停机"],"scenario_ids":["SCN-ROBOT-SAFETY"],"assessment":{"method":"观察+安全演示","pass_threshold":90,"evidence":["点检表","急停演示记录"]}},{"id":"MOD-ROBOT-TEACH","title":"示教编程与坐标标定","competency_ids":["COMP-ROBOT-TEACH"],"prerequisite_module_ids":["MOD-ROBOT-SAFETY"],"hours":20,"learning_outcomes":["建立TCP/Wobj坐标并完成无碰撞轨迹程序"],"scenario_ids":["SCN-ROBOT-TEACH"],"assessment":{"method":"程序实操+轨迹回放","pass_threshold":85,"evidence":["程序文件","坐标表","回放日志"]}},{"id":"MOD-ROBOT-DT","title":"数字孪生调试与故障诊断","competency_ids":["COMP-ROBOT-DT"],"prerequisite_module_ids":["MOD-ROBOT-TEACH"],"hours":16,"learning_outcomes":["在隔离仿真中验证I/O、碰撞和断链恢复"],"scenario_ids":["SCN-ROBOT-DT"],"assessment":{"method":"仿真任务+故障报告","pass_threshold":85,"evidence":["仿真日志","I/O映射表","故障报告"]}}],"tracking_chain":["JOB-ROBOT-001 -> COMP-ROBOT-SAFETY -> MOD-ROBOT-SAFETY -> SCN-ROBOT-SAFETY -> WO-ROBOT-SAFETY","JOB-ROBOT-001 -> COMP-ROBOT-TEACH -> MOD-ROBOT-TEACH -> SCN-ROBOT-TEACH -> WO-ROBOT-TEACH","JOB-ROBOT-001 -> COMP-ROBOT-DT -> MOD-ROBOT-DT -> SCN-ROBOT-DT -> WO-ROBOT-DT"]}